{
    "schema_version":  1,
    "source_kind":  "real",
    "generated_at":  "2026-07-15T14:06:41.2201566Z",
    "route":  {
                  "port":  2544,
                  "doctor_routed":  true,
                  "requests_before":  0,
                  "requests_after":  43,
                  "request_delta":  43
              },
    "metrics":  {
                    "qualified_token_savings_median":  0,
                    "quality_average":  3,
                    "fallback_rate":  0,
                    "p95_overhead_ms":  717.35,
                    "bypass_100_percent":  true
                },
    "promotion_verdict":  "HOLD",
    "requests":  [
                     {
                         "scenario_id":  "log-01",
                         "category":  "logs",
                         "source_kind":  "real",
                         "session_id":  "600ba659-2faf-41c8-be06-3a2d5faf67c8",
                         "request_ids":  [
                                             "hr_1784124213_000002",
                                             "hr_1784124207_000001",
                                             "hr_1784124218_000003"
                                         ],
                         "input_tokens":  3534,
                         "optimized_input_tokens":  3534,
                         "output_tokens":  439,
                         "token_savings_rate":  0,
                         "overhead_ms":  5793.4,
                         "elapsed_ms":  16503,
                         "fallback":  false,
                         "quality":  0,
                         "route":  "eligible",
                         "bypass_reason":  null,
                         "bypass_verified":  true,
                         "evidence_sha256":  "9BC0E70A5BB7E811944E1C3FF9161F02BE4DD4B85C2DA7878820FD0306BCE9EC"
                     },
                     {
                         "scenario_id":  "log-02",
                         "category":  "logs",
                         "source_kind":  "real",
                         "session_id":  "600ba659-2faf-41c8-be06-3a2d5faf67c8",
                         "request_ids":  [
                                             "hr_1784124224_000004",
                                             "hr_1784124228_000005"
                                         ],
                         "input_tokens":  10793,
                         "optimized_input_tokens":  10793,
                         "output_tokens":  222,
                         "token_savings_rate":  0,
                         "overhead_ms":  16.55,
                         "elapsed_ms":  8311,
                         "fallback":  false,
                         "quality":  0,
                         "route":  "eligible",
                         "bypass_reason":  null,
                         "bypass_verified":  true,
                         "evidence_sha256":  "2C3D5298F952D7FD0085EFA5AF4E6128879D62088E66E7A02D9073A9D5DB79B3"
                     },
                     {
                         "scenario_id":  "log-03",
                         "category":  "logs",
                         "source_kind":  "real",
                         "session_id":  "600ba659-2faf-41c8-be06-3a2d5faf67c8",
                         "request_ids":  [
                                             "hr_1784124233_000006",
                                             "hr_1784124237_000007"
                                         ],
                         "input_tokens":  16093,
                         "optimized_input_tokens":  16093,
                         "output_tokens":  443,
                         "token_savings_rate":  0,
                         "overhead_ms":  23.93,
                         "elapsed_ms":  12307,
                         "fallback":  false,
                         "quality":  0,
                         "route":  "eligible",
                         "bypass_reason":  null,
                         "bypass_verified":  true,
                         "evidence_sha256":  "5B28EFE7BA68BF51828150232FD0D205D61EED19D00F33407C7903F784763FD3"
                     },
                     {
                         "scenario_id":  "log-04",
                         "category":  "logs",
                         "source_kind":  "real",
                         "session_id":  "600ba659-2faf-41c8-be06-3a2d5faf67c8",
                         "request_ids":  [
                                             "hr_1784124245_000008",
                                             "hr_1784124248_000009"
                                         ],
                         "input_tokens":  20338,
                         "optimized_input_tokens":  20338,
                         "output_tokens":  239,
                         "token_savings_rate":  0,
                         "overhead_ms":  25.5,
                         "elapsed_ms":  7965,
                         "fallback":  false,
                         "quality":  0,
                         "route":  "eligible",
                         "bypass_reason":  null,
                         "bypass_verified":  true,
                         "evidence_sha256":  "44A5EDA9FE4168200DB4F9CAFE71965168B58BD56B99BD7D8F4A112F27CEBB45"
                     },
                     {
                         "scenario_id":  "log-05",
                         "category":  "logs",
                         "source_kind":  "real",
                         "session_id":  "600ba659-2faf-41c8-be06-3a2d5faf67c8",
                         "request_ids":  [
                                             "hr_1784124253_000010",
                                             "hr_1784124256_000011"
                                         ],
                         "input_tokens":  25610,
                         "optimized_input_tokens":  25610,
                         "output_tokens":  211,
                         "token_savings_rate":  0,
                         "overhead_ms":  32.38,
                         "elapsed_ms":  7865,
                         "fallback":  false,
                         "quality":  0,
                         "route":  "eligible",
                         "bypass_reason":  null,
                         "bypass_verified":  true,
                         "evidence_sha256":  "29D9FEA2C5F1D511D23C9A5481F23F24378A7CB7AA6D96C48A878FD89206EF9B"
                     },
                     {
                         "scenario_id":  "tool-01",
                         "category":  "tool_outputs",
                         "source_kind":  "real",
                         "session_id":  "600ba659-2faf-41c8-be06-3a2d5faf67c8",
                         "request_ids":  [
                                             "hr_1784124261_000012",
                                             "hr_1784124264_000013"
                                         ],
                         "input_tokens":  34776,
                         "optimized_input_tokens":  34776,
                         "output_tokens":  207,
                         "token_savings_rate":  0,
                         "overhead_ms":  42.37,
                         "elapsed_ms":  8773,
                         "fallback":  false,
                         "quality":  5,
                         "route":  "eligible",
                         "bypass_reason":  null,
                         "bypass_verified":  true,
                         "evidence_sha256":  "FFCBD464AAEA5824299B12244959BC6A0429721A7060E3985CB611255073FECD"
                     },
                     {
                         "scenario_id":  "tool-02",
                         "category":  "tool_outputs",
                         "source_kind":  "real",
                         "session_id":  "600ba659-2faf-41c8-be06-3a2d5faf67c8",
                         "request_ids":  [
                                             "hr_1784124270_000014",
                                             "hr_1784124280_000015"
                                         ],
                         "input_tokens":  45507,
                         "optimized_input_tokens":  45507,
                         "output_tokens":  199,
                         "token_savings_rate":  0,
                         "overhead_ms":  60.65,
                         "elapsed_ms":  16346,
                         "fallback":  false,
                         "quality":  5,
                         "route":  "eligible",
                         "bypass_reason":  null,
                         "bypass_verified":  true,
                         "evidence_sha256":  "0D4A1D4E4179A3C0DD8289E70AC4ECE91104E2F35C57E7484E582376ADC97085"
                     },
                     {
                         "scenario_id":  "tool-03",
                         "category":  "tool_outputs",
                         "source_kind":  "real",
                         "session_id":  "600ba659-2faf-41c8-be06-3a2d5faf67c8",
                         "request_ids":  [
                                             "hr_1784124286_000016",
                                             "hr_1784124290_000017"
                                         ],
                         "input_tokens":  51750,
                         "optimized_input_tokens":  51750,
                         "output_tokens":  199,
                         "token_savings_rate":  0,
                         "overhead_ms":  115.57,
                         "elapsed_ms":  7687,
                         "fallback":  false,
                         "quality":  5,
                         "route":  "eligible",
                         "bypass_reason":  null,
                         "bypass_verified":  true,
                         "evidence_sha256":  "E8E5025B76197B4D3E887E99CC50EEFCDE61274724B2EE787CFE42610E55872B"
                     },
                     {
                         "scenario_id":  "tool-04",